{
  "$schema": "./schema/ultimate.schema.json",
  "_note": "Тизер Ultimate 🔱: плитка на главной и экран /ultimate. Ultimate — будущее отдельное приложение, здесь только витрина и «Хочу первым».",
  "tile": {
    "title": "Ultimate",
    "subtitle": "скоро 🔥"
  },
  "header": "Ultimate",
  "badge": "GAZ Ultimate · скоро",
  "title": "Стань тем, кем хочешь",
  "lead": "GAZ показывает, кто ты. Ultimate помогает измениться: каждый день по шагу.",
  "tiles": [
    { "emoji": "⏰", "title": "Режим и дисциплина", "text": "Привычки, стрики, ритуалы" },
    { "emoji": "🏛️", "title": "Мыслители", "text": "Одна сильная идея в день" },
    { "emoji": "🧗", "title": "Программы на 30 дней", "text": "Тревога, самооценка, фокус" },
    { "emoji": "🌡️", "title": "Твоё состояние", "text": "Чекап, дневник, тренд" }
  ],
  "cta": "Хочу первым 🔔",
  "done": {
    "title": "Записали 🔥",
    "text": "Когда Ultimate запустится, позовём тебя первым"
  },
  "fine": "Отдельное приложение от команды GAZ"
}
